{
  "$schema": "https://json-schema.org/draft/2020-12/schema",
  "$id": "https://ver.cy/schemas/model-research/1.0.0",
  "title": "Vercy model research result",
  "type": "object",
  "additionalProperties": false,
  "required": [
    "schema_version",
    "model",
    "sources",
    "structure",
    "functions",
    "composition",
    "service_layers",
    "coverage"
  ],
  "properties": {
    "schema_version": {"const": "1.0.0"},
    "model": {"$ref": "#/$defs/model"},
    "sources": {
      "type": "array",
      "minItems": 6,
      "items": {"$ref": "#/$defs/source"}
    },
    "structure": {
      "type": "object",
      "additionalProperties": false,
      "required": ["bundles"],
      "properties": {
        "bundles": {
          "type": "array",
          "minItems": 1,
          "items": {"$ref": "#/$defs/bundle"}
        }
      }
    },
    "functions": {
      "type": "array",
      "minItems": 1,
      "items": {"$ref": "#/$defs/function"}
    },
    "composition": {
      "type": "array",
      "items": {"$ref": "#/$defs/composition"}
    },
    "service_layers": {"$ref": "#/$defs/serviceLayers"},
    "coverage": {"$ref": "#/$defs/coverage"}
  },
  "$defs": {
    "id": {
      "type": "string",
      "pattern": "^[a-z0-9]+(?:-[a-z0-9]+)*$"
    },
    "nonEmpty": {"type": "string", "minLength": 2},
    "sourceRefs": {
      "type": "array",
      "minItems": 1,
      "uniqueItems": true,
      "items": {"type": "string", "pattern": "^SRC-[0-9]{3}$"}
    },
    "model": {
      "type": "object",
      "additionalProperties": false,
      "required": [
        "registry_id",
        "model_id",
        "name",
        "entry_kind",
        "purpose",
        "scope_statement",
        "in_scope",
        "out_of_scope",
        "boundary_notes"
      ],
      "properties": {
        "registry_id": {"type": "string", "pattern": "^vr\\."},
        "model_id": {"type": "string", "pattern": "^WM-[A-Z0-9]+-[0-9]{3}$"},
        "name": {"$ref": "#/$defs/nonEmpty"},
        "entry_kind": {
          "enum": ["entity", "event", "relationship", "mixin", "pattern", "registry", "classifier", "aggregate"]
        },
        "purpose": {"$ref": "#/$defs/nonEmpty"},
        "scope_statement": {"$ref": "#/$defs/nonEmpty"},
        "in_scope": {"type": "array", "minItems": 2, "items": {"$ref": "#/$defs/nonEmpty"}},
        "out_of_scope": {"type": "array", "minItems": 1, "items": {"$ref": "#/$defs/nonEmpty"}},
        "boundary_notes": {
          "type": "array",
          "minItems": 1,
          "items": {
            "type": "object",
            "additionalProperties": false,
            "required": ["neighbor", "distinction", "source_refs"],
            "properties": {
              "neighbor": {"$ref": "#/$defs/nonEmpty"},
              "distinction": {"$ref": "#/$defs/nonEmpty"},
              "source_refs": {"$ref": "#/$defs/sourceRefs"}
            }
          }
        }
      }
    },
    "source": {
      "type": "object",
      "additionalProperties": false,
      "required": [
        "id",
        "title",
        "organization",
        "url",
        "version_or_date",
        "source_type",
        "primary_source",
        "authority_tier",
        "accessed_at",
        "relevance"
      ],
      "properties": {
        "id": {"type": "string", "pattern": "^SRC-[0-9]{3}$"},
        "title": {"$ref": "#/$defs/nonEmpty"},
        "organization": {"$ref": "#/$defs/nonEmpty"},
        "url": {"type": "string", "format": "uri", "pattern": "^https://"},
        "version_or_date": {"$ref": "#/$defs/nonEmpty"},
        "source_type": {
          "enum": ["standard", "schema", "ontology", "classifier", "registry", "legislation", "public-authority", "scientific", "first-party-doc", "secondary"]
        },
        "primary_source": {"type": "boolean"},
        "authority_tier": {"type": "integer", "minimum": 1, "maximum": 4},
        "accessed_at": {
          "type": "string",
          "pattern": "^\\d{4}-\\d{2}-\\d{2}T\\d{2}:\\d{2}:\\d{2}(?:Z|[+-]\\d{2}:\\d{2})$"
        },
        "relevance": {"$ref": "#/$defs/nonEmpty"}
      }
    },
    "bundle": {
      "type": "object",
      "additionalProperties": false,
      "required": ["id", "name", "description", "rationale", "source_refs", "layers"],
      "properties": {
        "id": {"$ref": "#/$defs/id"},
        "name": {"$ref": "#/$defs/nonEmpty"},
        "description": {"$ref": "#/$defs/nonEmpty"},
        "rationale": {"$ref": "#/$defs/nonEmpty"},
        "source_refs": {"$ref": "#/$defs/sourceRefs"},
        "layers": {"type": "array", "minItems": 1, "items": {"$ref": "#/$defs/layer"}}
      }
    },
    "layer": {
      "type": "object",
      "additionalProperties": false,
      "required": ["id", "name", "description", "source_refs", "findings"],
      "properties": {
        "id": {"$ref": "#/$defs/id"},
        "name": {"$ref": "#/$defs/nonEmpty"},
        "description": {"$ref": "#/$defs/nonEmpty"},
        "source_refs": {"$ref": "#/$defs/sourceRefs"},
        "findings": {"type": "array", "minItems": 1, "items": {"$ref": "#/$defs/finding"}}
      }
    },
    "finding": {
      "type": "object",
      "additionalProperties": false,
      "required": [
        "id",
        "name",
        "description",
        "source_refs",
        "questions",
        "data_elements",
        "artifacts",
        "inline_only_rationale"
      ],
      "properties": {
        "id": {"$ref": "#/$defs/id"},
        "name": {"$ref": "#/$defs/nonEmpty"},
        "description": {"$ref": "#/$defs/nonEmpty"},
        "source_refs": {"$ref": "#/$defs/sourceRefs"},
        "questions": {"type": "array", "minItems": 3, "items": {"$ref": "#/$defs/question"}},
        "data_elements": {"type": "array", "minItems": 1, "items": {"$ref": "#/$defs/dataElement"}},
        "artifacts": {"type": "array", "items": {"$ref": "#/$defs/artifact"}},
        "inline_only_rationale": {"type": ["string", "null"]}
      }
    },
    "question": {
      "type": "object",
      "additionalProperties": false,
      "required": ["id", "text", "kind", "answer_data"],
      "properties": {
        "id": {"$ref": "#/$defs/id"},
        "text": {"type": "string", "minLength": 8, "pattern": "\\?$"},
        "kind": {
          "enum": ["definition", "identity", "classification", "composition", "relationship", "state", "lifecycle", "temporal", "spatial", "provenance", "ownership", "authority", "requirement", "constraint", "process", "event", "measurement", "evidence", "quality", "validation", "security", "privacy", "retention", "access", "exception", "interoperability", "decision", "other"]
        },
        "answer_data": {"type": "array", "minItems": 1, "items": {"$ref": "#/$defs/nonEmpty"}}
      }
    },
    "dataElement": {
      "type": "object",
      "additionalProperties": false,
      "required": ["id", "name", "description", "value_kind", "cardinality", "required", "source_refs"],
      "properties": {
        "id": {"$ref": "#/$defs/id"},
        "name": {"$ref": "#/$defs/nonEmpty"},
        "description": {"$ref": "#/$defs/nonEmpty"},
        "value_kind": {"enum": ["identifier", "text", "boolean", "number", "quantity", "timestamp", "date", "duration", "code", "reference", "object", "collection", "geometry", "binary", "other"]},
        "cardinality": {"enum": ["0..1", "1", "0..n", "1..n"]},
        "required": {"type": "boolean"},
        "source_refs": {"$ref": "#/$defs/sourceRefs"}
      }
    },
    "artifact": {
      "type": "object",
      "additionalProperties": false,
      "required": ["id", "name", "description", "media_or_form", "serial", "identity_strategy", "source_refs"],
      "properties": {
        "id": {"$ref": "#/$defs/id"},
        "name": {"$ref": "#/$defs/nonEmpty"},
        "description": {"$ref": "#/$defs/nonEmpty"},
        "media_or_form": {"type": "array", "minItems": 1, "items": {"$ref": "#/$defs/nonEmpty"}},
        "serial": {"type": "boolean"},
        "identity_strategy": {"$ref": "#/$defs/nonEmpty"},
        "source_refs": {"$ref": "#/$defs/sourceRefs"}
      }
    },
    "function": {
      "type": "object",
      "additionalProperties": false,
      "required": ["id", "name", "description", "inputs", "outputs", "preconditions", "effects", "source_refs"],
      "properties": {
        "id": {"$ref": "#/$defs/id"},
        "name": {"$ref": "#/$defs/nonEmpty"},
        "description": {"$ref": "#/$defs/nonEmpty"},
        "inputs": {"type": "array", "items": {"$ref": "#/$defs/nonEmpty"}},
        "outputs": {"type": "array", "minItems": 1, "items": {"$ref": "#/$defs/nonEmpty"}},
        "preconditions": {"type": "array", "items": {"$ref": "#/$defs/nonEmpty"}},
        "effects": {"type": "array", "minItems": 1, "items": {"$ref": "#/$defs/nonEmpty"}},
        "source_refs": {"$ref": "#/$defs/sourceRefs"}
      }
    },
    "composition": {
      "type": "object",
      "additionalProperties": false,
      "required": ["target", "relation", "purpose", "required", "source_refs"],
      "properties": {
        "target": {"$ref": "#/$defs/nonEmpty"},
        "relation": {"enum": ["CHILD", "REFERENCE", "COMPOSE", "MIX-IN", "ALIGN", "EXTEND"]},
        "purpose": {"$ref": "#/$defs/nonEmpty"},
        "required": {"type": "boolean"},
        "source_refs": {"$ref": "#/$defs/sourceRefs"}
      }
    },
    "serviceLayers": {
      "type": "object",
      "additionalProperties": false,
      "required": ["dimension", "canon_and_patch", "artifact_rules", "policies", "crud", "roles", "access", "agents_bootstrap"],
      "properties": {
        "dimension": {
          "type": "object",
          "additionalProperties": false,
          "required": ["owner_package_requirements", "namespace_guidance", "registry_links"],
          "properties": {
            "owner_package_requirements": {"type": "array", "minItems": 3, "items": {"$ref": "#/$defs/nonEmpty"}},
            "namespace_guidance": {"$ref": "#/$defs/nonEmpty"},
            "registry_links": {"type": "array", "minItems": 1, "items": {"$ref": "#/$defs/nonEmpty"}}
          }
        },
        "canon_and_patch": {
          "type": "object",
          "additionalProperties": false,
          "required": ["canonicalization_rules", "patch_rules", "compatibility_rules"],
          "properties": {
            "canonicalization_rules": {"type": "array", "minItems": 1, "items": {"$ref": "#/$defs/nonEmpty"}},
            "patch_rules": {"type": "array", "minItems": 1, "items": {"$ref": "#/$defs/nonEmpty"}},
            "compatibility_rules": {"type": "array", "minItems": 1, "items": {"$ref": "#/$defs/nonEmpty"}}
          }
        },
        "artifact_rules": {
          "type": "object",
          "additionalProperties": false,
          "required": ["identity_priority", "timestamp_rule", "serial_naming_rule", "integrity_rule"],
          "properties": {
            "identity_priority": {"type": "array", "minItems": 3, "items": {"$ref": "#/$defs/nonEmpty"}},
            "timestamp_rule": {
              "type": "string",
              "allOf": [
                {"pattern": "RFC 3339"},
                {"pattern": "[Ss]econds?"},
                {"pattern": "[Oo]ffset"}
              ]
            },
            "serial_naming_rule": {"$ref": "#/$defs/nonEmpty"},
            "integrity_rule": {"$ref": "#/$defs/nonEmpty"}
          }
        },
        "policies": {"type": "array", "minItems": 2, "items": {"$ref": "#/$defs/nonEmpty"}},
        "crud": {
          "type": "object",
          "additionalProperties": false,
          "required": ["read", "create", "update", "delete"],
          "properties": {
            "read": {"type": "array", "minItems": 1, "items": {"$ref": "#/$defs/nonEmpty"}},
            "create": {"type": "array", "minItems": 1, "items": {"$ref": "#/$defs/nonEmpty"}},
            "update": {"type": "array", "minItems": 1, "items": {"$ref": "#/$defs/nonEmpty"}},
            "delete": {"type": "array", "minItems": 1, "items": {"$ref": "#/$defs/nonEmpty"}}
          }
        },
        "roles": {
          "type": "array",
          "minItems": 4,
          "items": {
            "type": "object",
            "additionalProperties": false,
            "required": ["name", "responsibilities"],
            "properties": {
              "name": {"$ref": "#/$defs/nonEmpty"},
              "responsibilities": {"type": "array", "minItems": 1, "items": {"$ref": "#/$defs/nonEmpty"}}
            }
          }
        },
        "access": {
          "type": "object",
          "additionalProperties": false,
          "required": ["default_rule", "scopes", "exceptions", "audit_requirements"],
          "properties": {
            "default_rule": {"$ref": "#/$defs/nonEmpty"},
            "scopes": {"type": "array", "minItems": 4, "items": {"enum": ["bundle", "layer", "finding", "artifact"]}},
            "exceptions": {"type": "array", "minItems": 1, "items": {"$ref": "#/$defs/nonEmpty"}},
            "audit_requirements": {"type": "array", "minItems": 1, "items": {"$ref": "#/$defs/nonEmpty"}}
          }
        },
        "agents_bootstrap": {
          "type": "object",
          "additionalProperties": false,
          "required": ["filename", "required_fields", "read_order"],
          "properties": {
            "filename": {"const": "AGENTS.md"},
            "required_fields": {
              "type": "array",
              "minItems": 6,
              "allOf": [
                {"contains": {"const": "Name"}},
                {"contains": {"const": "Type"}},
                {"contains": {"const": "Specification URL"}},
                {"contains": {"const": "Storage type URL"}},
                {"contains": {"const": "Interface URL"}},
                {"contains": {"const": "Processes URL"}}
              ],
              "items": {"$ref": "#/$defs/nonEmpty"}
            },
            "read_order": {"type": "array", "minItems": 2, "items": {"$ref": "#/$defs/nonEmpty"}}
          }
        }
      }
    },
    "coverage": {
      "type": "object",
      "additionalProperties": false,
      "required": ["claim", "confidence", "checklist", "known_omissions", "conflicts", "regional_assumptions", "adversarial_checks"],
      "properties": {
        "claim": {"$ref": "#/$defs/nonEmpty"},
        "confidence": {"enum": ["low", "medium", "high"]},
        "checklist": {
          "type": "array",
          "minItems": 10,
          "items": {
            "type": "object",
            "additionalProperties": false,
            "required": ["dimension", "status", "notes"],
            "properties": {
              "dimension": {"$ref": "#/$defs/nonEmpty"},
              "status": {"enum": ["covered", "not-applicable", "gap"]},
              "notes": {"$ref": "#/$defs/nonEmpty"}
            }
          }
        },
        "known_omissions": {"type": "array", "items": {"$ref": "#/$defs/nonEmpty"}},
        "conflicts": {"type": "array", "items": {"$ref": "#/$defs/nonEmpty"}},
        "regional_assumptions": {"type": "array", "items": {"$ref": "#/$defs/nonEmpty"}},
        "adversarial_checks": {"type": "array", "minItems": 3, "items": {"$ref": "#/$defs/nonEmpty"}}
      }
    }
  }
}
