{
  "schema_version": "1.0.0",
  "model": {
    "registry_id": "vr.wm-xct-032",
    "model_id": "WM-XCT-032",
    "name": "Currency / Monetary Value",
    "entry_kind": "mixin",
    "purpose": "Provide a reusable mixin that binds an exact amount to a currency, a measurement basis, a valuation instant and a declared precision, and that governs how monetary values are validated, quantised, valued or converted, reconciled, exported and redacted reproducibly.",
    "scope_statement": "WM-XCT-032 defines the format-neutral semantics of a monetary value carried inside any host record: the exact decimal amount, the currency identifier and its status in the ISO 4217 register, the declared scale and rounding policy, the measurement basis, and the valuation/effective instant. It further defines the calculation, reconciliation and projection operation semantics that make monetary values comparable and reproducible: admissibility validation, quantisation and residual handling, valuation and conversion against an externally supplied rate binding with full derivation lineage, reconciliation against a declared tolerance, and lossy or redacted export. Every derived value preserves the original amount and currency. Functions in this model calculate or report only; they never acquire rates, move money, post to a ledger, persist records, authorise disclosure or enforce policy.",
    "in_scope": [
      "Monetary value structure: exact decimal amount, ISO 4217 currency identifier, declared scale, measurement basis, valuation instant.",
      "Admissibility validation of a monetary value against a caller-pinned profile (allowed currency set, digit limits, required attributes).",
      "Quantisation semantics: target scale, rounding mode, tie-breaking, residual computation and residual allocation across a set.",
      "Valuation and conversion computation from an externally supplied rate binding, including base/quote direction, rate chains and intermediate scale.",
      "Derivation lineage that preserves the original amount and currency and makes any derived value recomputable.",
      "Reconciliation of a set of monetary values against a declared tolerance, with attribution of unexplained difference.",
      "Projection of monetary values into target representations, including explicitly lossy, rounded, banded or redacted exports.",
      "An explicit outcome taxonomy for missing, stale, ambiguous or non-exchangeable rates, unsupported currencies, invalid inverses, precision loss, out-of-tolerance reconciliation and lossy export."
    ],
    "out_of_scope": [
      "Acquisition, publication, licensing or quality assurance of exchange rates and market data.",
      "Payment initiation, clearing, settlement and any movement of funds.",
      "Accounting recognition, ledger posting, presentation-currency translation of a full reporting entity, and disclosure drafting.",
      "Persistence, storage engines, indexing and query interfaces.",
      "Authorisation decisions, policy evaluation, enforcement and audit-trail construction.",
      "Interest, discounting, day-count conventions, present value and hedge accounting.",
      "Definition or maintenance of the currency register itself, including code assignment and withdrawal.",
      "Tax computation and jurisdiction-specific statutory rate mandates."
    ],
    "boundary_notes": [
      {
        "neighbor": "Currency register / ISO 4217 maintenance agency",
        "distinction": "This model references currency codes, numeric codes, minor units and code status by identifier and register version; it does not assign, amend or republish currency codes, and it treats register amendments (for example the 2026 Bulgarian lev to euro change) as external facts to be resolved, not owned.",
        "source_refs": [
          "SRC-001"
        ]
      },
      {
        "neighbor": "Exchange-rate source / market data service",
        "distinction": "Rate acquisition, publication timing and fitness-for-purpose are owned by the rate publisher. This model consumes a rate binding as an input and records provenance; it never fetches, caches as authoritative, or asserts that a published reference rate is suitable for transaction pricing.",
        "source_refs": [
          "SRC-006",
          "SRC-007"
        ]
      },
      {
        "neighbor": "Accounting and financial reporting model",
        "distinction": "Which rate an entity must apply, how exchange differences are recognised, and how a reporting entity is translated into a presentation currency are accounting-standard decisions. This model carries the measurement basis and reference-time selector as parameters and computes the arithmetic; it does not choose the accounting policy or post its effects.",
        "source_refs": [
          "SRC-002",
          "SRC-003"
        ]
      },
      {
        "neighbor": "Payment message and scheme model",
        "distinction": "Message-level field constraints, scheme currency restrictions and settlement semantics belong to the payment standard and scheme. This model aligns its validation profile to such constraints when the caller pins one, but does not model messages, instructions or settlement.",
        "source_refs": [
          "SRC-010",
          "SRC-013"
        ]
      },
      {
        "neighbor": "Policy decision, authorisation and audit services",
        "distinction": "Redaction, suppression and disclosure require an authorisation decision made elsewhere. This model carries the decision reference and applies the directed transformation; it owns neither the evaluation, the enforcement, nor the audit trail of that decision.",
        "source_refs": [
          "SRC-012"
        ]
      },
      {
        "neighbor": "Business reporting fact model (XBRL/OIM)",
        "distinction": "Reporting frameworks define fact-level units, decimals and calculation networks for whole reports. This model reuses their precision and interval semantics for a single monetary value and its reconciliation set, and does not model taxonomies, contexts, dimensions or filing rules.",
        "source_refs": [
          "SRC-004",
          "SRC-005"
        ]
      }
    ]
  },
  "sources": [
    {
      "id": "SRC-001",
      "title": "Data standards — ISO 4217 currency codes (Maintenance Agency)",
      "organization": "SIX Group AG",
      "url": "https://www.six-group.com/en/products-services/financial-information/data-standards.html",
      "version_or_date": "Current currency code lists (List One, List Two, List Three) with amendment effective 2026-01-01 for BGN/EUR",
      "source_type": "registry",
      "primary_source": true,
      "authority_tier": 1,
      "accessed_at": "2026-09-04T09:00:00Z",
      "relevance": "Authoritative maintenance agency for ISO 4217 alphabetic codes, numeric codes and minor units, and for the active/historic/fund code lists that determine currency admissibility and code status."
    },
    {
      "id": "SRC-002",
      "title": "IAS 21 The Effects of Changes in Foreign Exchange Rates",
      "organization": "IFRS Foundation / International Accounting Standards Board",
      "url": "https://www.ifrs.org/content/dam/ifrs/publications/html-standards/english/2025/issued/ias21.html",
      "version_or_date": "2025 issued standards; lack-of-exchangeability amendments effective 1 January 2025",
      "source_type": "standard",
      "primary_source": true,
      "authority_tier": 1,
      "accessed_at": "2026-09-04T09:00:00Z",
      "relevance": "Normative definitions of spot rate, closing rate, exchange difference and monetary items; rules on which rate applies to monetary versus non-monetary items; criteria for exchangeability and the multiple-rates case."
    },
    {
      "id": "SRC-003",
      "title": "IFRS 13 Fair Value Measurement",
      "organization": "IFRS Foundation / International Accounting Standards Board",
      "url": "https://www.ifrs.org/content/dam/ifrs/publications/html-standards/english/2025/issued/ifrs13.html",
      "version_or_date": "2025 issued standards; IFRS 13 issued May 2011",
      "source_type": "standard",
      "primary_source": true,
      "authority_tier": 1,
      "accessed_at": "2026-09-04T09:00:00Z",
      "relevance": "Grounds the measurement-basis and measurement-date attributes, the principal/most advantageous market concept and the observability hierarchy used to classify a rate or price input."
    },
    {
      "id": "SRC-004",
      "title": "Calculations 1.1",
      "organization": "XBRL International",
      "url": "https://www.xbrl.org/Specification/calculation-1.1/REC-2023-02-22/calculation-1.1-REC-2023-02-22.html",
      "version_or_date": "Recommendation, 22 February 2023",
      "source_type": "standard",
      "primary_source": true,
      "authority_tier": 1,
      "accessed_at": "2026-09-04T09:00:00Z",
      "relevance": "Normative interval-based definition of calculation consistency derived from declared decimals, distinct round-to-nearest and truncation intervals, duplicate-fact handling and explicit inconsistency error codes — the basis for tolerance semantics in reconciliation."
    },
    {
      "id": "SRC-005",
      "title": "Precision, Decimals and Units 1.0",
      "organization": "XBRL International",
      "url": "https://www.xbrl.org/WGN/precision-decimals-units/WGN-2017-01-11/precision-decimals-units-WGN-2017-01-11.html",
      "version_or_date": "Working Group Note, 11 January 2017",
      "source_type": "standard",
      "primary_source": true,
      "authority_tier": 2,
      "accessed_at": "2026-09-04T09:00:00Z",
      "relevance": "Explains that a reported numeric value with declared decimals or precision denotes an interval of plausible source values, the ISO 4217 currency unit namespace for monetary facts, and the risk of aggregating facts with incompatible units or scales."
    },
    {
      "id": "SRC-006",
      "title": "Euro foreign exchange reference rates",